{
  "schema": "bricksmith.design.v1",
  "name": "Instrument pedestal",
  "description": "An explicit solid with a recessed upper well.",
  "bounds": {
    "min": [
      -4,
      0,
      -4
    ],
    "size": [
      8,
      15,
      8
    ]
  },
  "shapes": [
    {
      "op": "add",
      "color": 71,
      "shape": {
        "type": "box",
        "min": [
          -4,
          0,
          -4
        ],
        "size": [
          8,
          3,
          8
        ]
      }
    },
    {
      "op": "add",
      "color": 1,
      "shape": {
        "type": "cylinder",
        "center": [
          0,
          9,
          0
        ],
        "radius": 3,
        "height": 12,
        "axis": "y"
      }
    },
    {
      "op": "subtract",
      "shape": {
        "type": "box",
        "min": [
          -1,
          10,
          -1
        ],
        "size": [
          2,
          5,
          2
        ]
      }
    }
  ],
  "packing": {
    "mode": "mixed",
    "maxPieces": 500
  }
}
